{
	"_id": 111010,
	"id": "InsulationPotion",
	"name": "Insulation Potion",
	"description": "ยาน้ำสำหรับป้องกันไฟฟ้า สามารถเพิ่มความต้านทานไฟฟ้าได้ <br/>เมื่อดื่มจะให้ความรู้สึกซ่าๆ ว่ากันว่ายานี้จะช่วยเพิ่มความต้าน ไฟฟ้าให้แก่ผู้ที่ดื่ม จึงสามารถลดความเสียหายจากการถูกโจมตีด้วยไฟฟ้าได้",
	"effect": "เพิ่มความต้านทานไฟฟ้าให้แก่สมาชิกทีมทุกคน 25% เป็นเวลา 300 วินาที",
	"craft": {
		"cost": 100,
		"items": [
			{
				"_id": 100072,
				"id": "ButterflyWings",
				"name": "Butterfly Wings",
				"amount": 1
			},
			{
				"_id": 100054,
				"id": "ElectroCrystal",
				"name": "Electro Crystal",
				"amount": 1
			}
		]
	},
	"rarity": 3
}