{
	"_id": 111008,
	"id": "FrostshieldPotion",
	"name": "Frostshield Potion",
	"description": "A miraculous potion that boosts Cryo RES and makes one able to withstand extreme cold.<br/>Induces a chilling sensation when drank, but once this sensation spreads throughout the body, the feeling of being cold disappears.",
	"effect": "Increases all party members' Cryo RES by 25% for 300s.",
	"craft": {
		"cost": 100,
		"items": [
			{
				"_id": 100085,
				"id": "CrystalCore",
				"name": "Crystal Core",
				"amount": 1
			},
			{
				"_id": 100052,
				"id": "MistFlowerCorolla",
				"name": "Mist Flower Corolla",
				"amount": 1
			}
		]
	},
	"rarity": 3
}