{
	"_id": 111014,
	"id": "StreamingEssentialOil",
	"name": "Olio essenziale idratante",
	"description": "Conferisce maggiore affinità a Hydro, aumentando i DAN da Hydro.<br/>È una medicina oleosa per uso esterno. Permette di incanalare al meglio l'energia di Hydro. Ha un profumo lieve.",
	"effect": "Aumenta di un 25% i DAN da Hydro di tutti i membri del gruppo per 300 s.",
	"craft": {
		"cost": 100,
		"items": [
			{
				"_id": 100081,
				"id": "Frog",
				"name": "Rana",
				"amount": 1
			},
			{
				"_id": 100026,
				"id": "LotusHead",
				"name": "Frutto di loto",
				"amount": 1
			}
		]
	},
	"rarity": 3
}