{
	"_id": 111007,
	"id": "DesiccantPotion",
	"name": "Potion de résistance Hydro",
	"description": "Une potion mystérieuse qui permet de résister aux environnements humides et augmente la RÉS Hydro.<br/>Cette potion agit comme dessicateur, et est particulièrement utile pour la conservation des objets ; elle peut être ingérée pour le même effet.",
	"effect": "Augmente les RÉS Hydro de tous les personnages de l'équipe de 25 % pendant 300 s.",
	"craft": {
		"cost": 100,
		"items": [
			{
				"_id": 100072,
				"id": "ButterflyWings",
				"name": "Ailes de papillon",
				"amount": 1
			},
			{
				"_id": 100026,
				"id": "LotusHead",
				"name": "Fruit du lotus",
				"amount": 1
			}
		]
	},
	"rarity": 3
}